<?xml version="1.0" encoding="UTF-8"?>
<rlsg xmlns:xsi="http://www.w3.org/2001/XMLSchema-instance" xsi:noNamespaceSchemaLocation="rlsg.xsd">
	<scene href="CFP_Scene_1.convex.wrl">
		<model name="Robot_KR60-3_WithGripper">
			<body name="link0"/>
			<body name="link1"/>
			<body name="link2"/>
			<body name="link3"/>
			<body name="link4"/>
			<body name="link5"/>
			<body name="link6"/>
		</model>
		<model name="TestRoom">
			<body name="wall"/>
			<body name="floor"/>
			<body name="column1"/>
			<body name="column2"/>
			<body name="column3"/>
			<!--<body name="halfcolumn"/>-->
			<body name="hanger"/>
			<body name="deposittable"/>
		</model>
	</scene>
</rlsg>
