<?xml version="1.0" encoding="UTF-8"?>
<rlsg xmlns:xsi="http://www.w3.org/2001/XMLSchema-instance" xsi:noNamespaceSchemaLocation="rlsg.xsd">
	<scene href="uman_wall2.wrl">
		<model name="uman">
			<body name="link0" />
			<body name="link1" />
			<body name="link2" />
			<body name="link3" />
			<body name="link4" />
			<body name="link5" />
			<body name="link6" />
			<body name="link7" />
			<body name="link8" />
			<body name="link9" />
			<body name="link10" />
		</model>
		<model name="wall2">
			<body name="" />
		</model>
	</scene>
</rlsg>

