<?xml version="1.0" encoding="UTF-8"?>
<rlsg xmlns:xsi="http://www.w3.org/2001/XMLSchema-instance" xsi:noNamespaceSchemaLocation="rlsg.xsd">
	<scene href="mitsubishi-rv6sl_boxes.convex.wrl">
		<model name="mitsubishi-rv6sl">
			<body name="link0"/>
			<body name="link1"/>
			<body name="link2"/>
			<body name="link3"/>
			<body name="link4"/>
			<body name="link5"/>
			<body name="link6"/>
		</model>
		<model name="boxes">
			<body name=""/>
		</model>
	</scene>
</rlsg>
