<?xml version="1.0" encoding="UTF-8"?>
<rlsg xmlns:xsi="http://www.w3.org/2001/XMLSchema-instance" xsi:noNamespaceSchemaLocation="rlsg.xsd">
  <scene href="2d-gripper-maze.wrl">
    <model name="box-2d-050505">
      <body name="link0" />
      <body name="link1" />
      <body name="body1" />
    </model>
    <model name="boxes">
      <body name=""/>
    </model>
  </scene>
</rlsg>
