<?xml version="1.0" encoding="UTF-8"?>
<rlsg xmlns:xsi="http://www.w3.org/2001/XMLSchema-instance" xsi:noNamespaceSchemaLocation="rlsg.xsd">
	<scene href="jahir.wrl">
		<model name="rv6sl">
			<body name="link0"/>
			<body name="link1"/>
			<body name="link2"/>
			<body name="link3"/>
			<body name="link4"/>
			<body name="link5"/>
			<body name="link6"/>
		</model>
		<model name="jahir">
			<body name="base"/>
			<body name="table"/>
			<body name="green"/>
			<body name="blue"/>
			<body name="obstacles1"/>
			<!--<body name="obstacles2"/>-->
		</model>
	</scene>
</rlsg>
