<?xml version="1.0" encoding="UTF-8"?>
<rlsg xmlns:xsi="http://www.w3.org/2001/XMLSchema-instance" xsi:noNamespaceSchemaLocation="rlsg.xsd">
	<scene href="example.wrl">
		<model name="robot">
			<body name="link0"/>
			<body name="link1"/>
			<body name="link2"/>
		</model>
		<model name="obstacles">
			<body name="floor"/>
			<body name="obstacle1"/>
			<body name="obstacle2"/>
			<body name="obstacle3"/>
			<body name="obstacle4"/>
		</model>
	</scene>
</rlsg>
